{
  "schema": "math-task/v1",
  "task_id": "math-task-0002",
  "problem_id": "synthetic-graph-0007",
  "title": "Triangle-free 5-regular graphs on 12 vertices",
  "statement": "There exists a triangle-free 5-regular simple graph on 12 vertices.",
  "object_domain": "simple graphs on exactly 12 labeled vertices",
  "quantifiers": "exists G in the frozen finite class",
  "assumptions": [
    "standard graph-theoretic definitions"
  ],
  "dependencies": [
    "exhaustive enumeration library enumgraphs 0.3"
  ],
  "sought": "decide",
  "scope": {
    "object_range": "5-regular simple graphs on 12 vertices",
    "data": "synthetic enumeration, deterministic seed 20260816"
  },
  "resources": {
    "compute": "local-cpu",
    "budget_minutes": 45
  },
  "completion_criteria": [
    "One witness graph with an independently checked certificate, or a complete enumeration showing absence."
  ],
  "permissions": [
    "read:repo"
  ],
  "allowed_external_effects": [],
  "created_at": "2026-08-16T10:30:00Z"
}
